title,authors,year,source,raw
Natural Language-Assisted Multi-modal Medication Recommendation,"Tan, Jie and Rong, Yu and Zhao, Kangfei and Bian, Tian and Xu, Tingyang and Huang, Junzhou and Cheng, Hong and Meng, Helen",2024.0,ACM,"{'series': ""CIKM '24"", 'location': 'Boise, ID, USA', 'keywords': 'combinatorial medication recommendation, multi-modal alignment, pretrained language models', 'numpages': '10', 'pages': '2200–2209', 'booktitle': 'Proceedings of the 33rd ACM International Conference on Information and Knowledge Management', 'abstract': 'Combinatorial medication recommendation (CMR) is a fundamental task of healthcare, which offers opportunities for clinical physicians to provide more precise prescriptions for patients with intricate health conditions, particularly in the scenarios of long-term medical care. Previous research efforts have sought to extract meaningful information from electronic health records (EHRs) to facilitate combinatorial medication recommendations. Existing learning-based approaches further consider the chemical structures of medications, but ignore the textual medication descriptions in which the functionalities are clearly described. Furthermore, the textual knowledge derived from the EHRs of patients remains largely underutilized. To address these issues, we introduce the Natural Language-Assisted Multi-modal Medication Recommendation (NLA-MMR), a multimodal alignment framework designed to learn knowledge from the patient view and medication view jointly. Specifically, NLA-MMR formulates CMR as an alignment problem from patient and medication modalities. In this vein, we employ pretrained language models (PLMs) to extract in-domain knowledge regarding patients and medications, serving as the foundational representation for both modalities. In the medication modality, we exploit both chemical structures and textual descriptions to create medication representations. In the patient modality, we generate the patient representations based on textual descriptions of diagnosis, procedure, and symptom. Extensive experiments conducted on three publicly accessible datasets demonstrate that NLA-MMR achieves new state-of-the-art performance, with a notable average improvement of 4.72% in Jaccard score.', 'doi': '10.1145/3627673.3679529', 'url': 'https://doi.org/10.1145/3627673.3679529', 'address': 'New York, NY, USA', 'publisher': 'Association for Computing Machinery', 'isbn': '9798400704369', 'year': '2024', 'title': 'Natural Language-Assisted Multi-modal Medication Recommendation', 'author': 'Tan, Jie and Rong, Yu and Zhao, Kangfei and Bian, Tian and Xu, Tingyang and Huang, Junzhou and Cheng, Hong and Meng, Helen', 'ENTRYTYPE': 'inproceedings', 'ID': '10.1145/3627673.3679529'}"
ALGNet: Attention Light Graph Memory Network for Medical Recommendation System,"Nguyen, Minh-Van and Nguyen, Duy-Thinh and Trinh, Quoc-Huy and Le, Bac",2023.0,ACM,"{'series': ""SOICT '23"", 'location': 'Ho Chi Minh, Vietnam', 'keywords': 'Electronic health record system, Light Graph Convolutional Network, Medical Recommendation, Memory Network.', 'numpages': '8', 'pages': '570–577', 'booktitle': 'Proceedings of the 12th International Symposium on Information and Communication Technology', 'abstract': 'Medication recommendation is a vital task for improving patient care and reducing adverse events. However, existing methods often fail to capture the complex and dynamic relationships among patient medical records, drug efficacy and safety, and drug-drug interactions (DDI). In this paper, we propose ALGNet, a novel model that leverages light graph convolutional networks (LGCN) and augmentation memory networks (AMN) to enhance medication recommendation. LGCN can efficiently encode the patient records and the DDI graph into low-dimensional embeddings, while AMN can augment the patient representation with external knowledge from a memory module. We evaluate our model on the MIMIC-III dataset and show that it outperforms several baselines in terms of recommendation accuracy and DDI avoidance. We also conduct an ablation study to analyze the effects of different components of our model. Our results demonstrate that ALGNet can achieve superior performance with less computation and more interpretability.', 'doi': '10.1145/3628797.3628983', 'url': 'https://doi.org/10.1145/3628797.3628983', 'address': 'New York, NY, USA', 'publisher': 'Association for Computing Machinery', 'isbn': '9798400708916', 'year': '2023', 'title': 'ALGNet: Attention Light Graph Memory Network for Medical Recommendation System', 'author': 'Nguyen, Minh-Van and Nguyen, Duy-Thinh and Trinh, Quoc-Huy and Le, Bac', 'ENTRYTYPE': 'inproceedings', 'ID': '10.1145/3628797.3628983'}"
CIDGMed: Causal Inference-Driven Medication Recommendation with Enhanced Dual-Granularity Learning,"Liang, Shunpan and Li, Xiang and Mu, Shi and Li, Chen and Lei, Yu and Hou, Yulei and Ma, Tengfei",2025.0,ACM,"{'keywords': 'Medication recommendation, Intelligent healthcare management, Causal inference, Recommender systems', 'numpages': '16', 'month': 'January', 'journal': 'Know.-Based Syst.', 'doi': '10.1016/j.knosys.2024.112685', 'url': 'https://doi.org/10.1016/j.knosys.2024.112685', 'issn': '0950-7051', 'number': 'C', 'volume': '309', 'address': 'NLD', 'publisher': 'Elsevier Science Publishers B. V.', 'issue_date': 'Jan 2025', 'year': '2025', 'title': 'CIDGMed: Causal Inference-Driven Medication Recommendation with Enhanced Dual-Granularity Learning', 'author': 'Liang, Shunpan and Li, Xiang and Mu, Shi and Li, Chen and Lei, Yu and Hou, Yulei and Ma, Tengfei', 'ENTRYTYPE': 'article', 'ID': '10.1016/j.knosys.2024.112685'}"
PROMISE: A pre-trained knowledge-infused multimodal representation learning framework for medication recommendation,"Wu, Jialun and Yu, Xinyao and He, Kai and Gao, Zeyu and Gong, Tieliang",2024.0,ACM,"{'keywords': 'Multimodal learning, Healthcare, Data mining, Medication recommendation', 'numpages': '29', 'month': 'July', 'journal': 'Inf. Process. Manage.', 'doi': '10.1016/j.ipm.2024.103758', 'url': 'https://doi.org/10.1016/j.ipm.2024.103758', 'issn': '0306-4573', 'number': '4', 'volume': '61', 'address': 'USA', 'publisher': 'Pergamon Press, Inc.', 'issue_date': 'Jul 2024', 'year': '2024', 'title': 'PROMISE: A pre-trained knowledge-infused multimodal representation learning framework for medication recommendation', 'author': 'Wu, Jialun and Yu, Xinyao and He, Kai and Gao, Zeyu and Gong, Tieliang', 'ENTRYTYPE': 'article', 'ID': '10.1016/j.ipm.2024.103758'}"
Drug Recommendation Combining Attention Mechanism and Graph Encoder,"Wang, Yonggui and Lu, Bixian",2024.0,ACM,"{'series': ""ICIEAI '23"", 'location': 'Xiamen, China', 'numpages': '6', 'pages': '750–755', 'booktitle': 'Proceedings of the 2023 International Conference on Information Education and Artificial Intelligence', 'abstract': ""Drug recommendation is an vital mission in the field of intelligent healthcare. Since patients often suffer from multiple diseases and the disease status is dynamic, the model must take drug interactions into account when recommending drugs. However, most existing drug recommendation works only rely on patient electronic health records for medical predictions, current methods do not fully exploit the patient information and their interrelationships when constructing patient narratives, resulting in insufficient completeness of patient narratives. They also overlook the future trend of patient's condition changes, resulting in a high rate of DDI in recommended drug combinations. To work around these limitations, this paper proposes a drug recommendation model that combines attention mechanism and graph encoder. Encode different types of medical codes in patient presentations using access level codes and attention systems. At the same time, a drug graph encoder is designed to extract and encode key information based on the structural features of drug molecules. Comparison with current state-of-the-art basic model, the proposed model achieves a large degree of improvement."", 'doi': '10.1145/3660043.3660177', 'url': 'https://doi.org/10.1145/3660043.3660177', 'address': 'New York, NY, USA', 'publisher': 'Association for Computing Machinery', 'isbn': '9798400716157', 'year': '2024', 'title': 'Drug Recommendation Combining Attention Mechanism and Graph Encoder', 'author': 'Wang, Yonggui and Lu, Bixian', 'ENTRYTYPE': 'inproceedings', 'ID': '10.1145/3660043.3660177'}"
Conditional Generation Net for Medication Recommendation,"Wu, Rui and Qiu, Zhaopeng and Jiang, Jiacheng and Qi, Guilin and Wu, Xian",2022.0,ACM,"{'series': ""WWW '22"", 'location': 'Virtual Event, Lyon, France', 'keywords': 'electronic health record, generation, medication recommendation', 'numpages': '11', 'pages': '935–945', 'booktitle': 'Proceedings of the ACM Web Conference 2022', 'abstract': 'Medication recommendation targets to provide a proper set of medicines according to patients’ diagnoses, which is a critical task in clinics. Currently, the recommendation is manually conducted by doctors. However, for complicated cases, like patients with multiple diseases at the same time, it’s difficult to propose a considerate recommendation even for experienced doctors. This urges the emergence of automatic medication recommendation which can help treat the diagnosed diseases without causing harmful drug-drug interactions. Due to the clinical value, medication recommendation has attracted growing research interests. Existing works mainly formulate medication recommendation as a multi-label classification task to predict the set of medicines. In this paper, we propose the Conditional Generation Net (COGNet) which introduces a novel copy-or-predict mechanism to generate the set of medicines. Given a patient, the proposed model first retrieves his or her historical diagnoses and medication recommendations and mines their relationship with current diagnoses. Then in predicting each medicine, the proposed model decides whether to copy a medicine from previous recommendations or to predict a new one. This process is quite similar to the decision process of human doctors. We validate the proposed model on the public MIMIC data set, and the experimental results show that the proposed model can outperform state-of-the-art approaches.', 'doi': '10.1145/3485447.3511936', 'url': 'https://doi.org/10.1145/3485447.3511936', 'address': 'New York, NY, USA', 'publisher': 'Association for Computing Machinery', 'isbn': '9781450390965', 'year': '2022', 'title': 'Conditional Generation Net for Medication Recommendation', 'author': 'Wu, Rui and Qiu, Zhaopeng and Jiang, Jiacheng and Qi, Guilin and Wu, Xian', 'ENTRYTYPE': 'inproceedings', 'ID': '10.1145/3485447.3511936'}"
Medication Recommendation Based on a Knowledge-enhanced Pre-training Model,"Wang, Mengzhen and Chen, Jianhui and Lin, Shaofu",2022.0,ACM,"{'series': ""WI-IAT '21"", 'location': 'Melbourne, VIC, Australia', 'keywords': 'Electronic medical record, Graph Attention Network, Medication recommendation, Pre-training model', 'numpages': '5', 'pages': '290–294', 'booktitle': 'IEEE/WIC/ACM International Conference on Web Intelligence and Intelligent Agent Technology', 'abstract': 'More and more attention has been paid to electronic medical record (EMR)-based auxiliary diagnosis and treatment, in which medication recommendation is an important research direction. The existing medication recommendation models mainly depend on the data of patients, diagnosis and medications. However, the insufficient amount of clinical data with temporal dependencies becomes a major obstacle. This paper proposes a new knowledge-enhanced pre-training model for medication recommendation. On the one hand, the classification knowledge in diagnostic codes and drug codes is encoded by Graph Attention Network and fused into the clinical data for expanding the data content. On the other hand, a large number of single visit data of EMR are used to create the pre-trained visit model by a modified BERT for expanding the data scale. The experimental results on EMR data from more than 2,000 medical and health institutions in Hainan, China show that the fusion of classification knowledge and pre-training model can effectively improve the accuracy of medication recommendation.', 'doi': '10.1145/3498851.3498968', 'url': 'https://doi.org/10.1145/3498851.3498968', 'address': 'New York, NY, USA', 'publisher': 'Association for Computing Machinery', 'isbn': '9781450391870', 'year': '2022', 'title': 'Medication Recommendation Based on a Knowledge-enhanced Pre-training Model', 'author': 'Wang, Mengzhen and Chen, Jianhui and Lin, Shaofu', 'ENTRYTYPE': 'inproceedings', 'ID': '10.1145/3498851.3498968'}"
Knowledge enhanced attention aggregation network for medicine recommendation,"Wei, Jiedong and Zhang, Yijia and Li, Xingwang and Lu, Mingyu and Lin, Hongfei",2024.0,ACM,"{'keywords': 'Medicine recommendation, Attention aggregation network, Drug–drug interactions, Graph convolution', 'numpages': '9', 'month': 'August', 'journal': 'Comput. Biol. Chem.', 'doi': '10.1016/j.compbiolchem.2024.108099', 'url': 'https://doi.org/10.1016/j.compbiolchem.2024.108099', 'issn': '1476-9271', 'number': 'C', 'volume': '111', 'address': 'NLD', 'publisher': 'Elsevier Science Publishers B. V.', 'issue_date': 'Aug 2024', 'year': '2024', 'title': 'Knowledge enhanced attention aggregation network for medicine recommendation', 'author': 'Wei, Jiedong and Zhang, Yijia and Li, Xingwang and Lu, Mingyu and Lin, Hongfei', 'ENTRYTYPE': 'article', 'ID': '10.1016/j.compbiolchem.2024.108099'}"
Ontology-aware Prescription Recommendation in Treatment Pathways Using Multi-evidence Healthcare Data,"Yao, Zijun and Liu, Bin and Wang, Fei and Sow, Daby and Li, Ying",2023.0,ACM,"{'keywords': 'Drug Recommendation, Ontology, Electronic Health Records', 'numpages': '29', 'articleno': '99', 'month': 'April', 'journal': 'ACM Trans. Inf. Syst.', 'abstract': 'For care of chronic diseases (e.g., depression, diabetes, hypertension), it is critical to identify effective treatment pathways that aim to promptly update the medication following the change of patient state and disease progression. This task is challenging because the optimal treatment pathway for each patient needs to be personalized due to the significant heterogeneity among individuals. Therefore, it is naturally promising to investigate how to use the abundant electronic health records to recommend effective and safe prescriptions. However, prescription recommendation needs to consider multiple aspects of life-critical evidence, such as the information relevance in terms of medical concepts, the health condition in terms of diagnosis history, and the further constraint in terms of side information (e.g., patient demographics and drug side effects). To this end, in this article, we propose a novel prescription recommendation framework named OntoPath to predict the next drug in disease treatment pathways, by building an ontology-aware hierarchical-attention model that integrates multiple medical evidence from domain knowledge guidance, medical history profiling, and side information utilization. Specifically, our method can be characterized from three aspects: (1) by incorporating the longitudinal diagnosis history, we enrich the profiling of patients in terms of comprehensive health conditions, which can largely influence a drug’s outcome on individual patients; (2) using the hierarchical disease and drug ontology structures, we are able to model the domain-specific relevance between patients and drugs at multiple levels of granularity and achieve in-depth collaborative filtering; (3) we introduce a pre-training stage to enhance the discriminativeness of network representations, which helps us obtain a premium model initialization to further boost the final recommendation training. We perform extensive experiments on a large-scale depression cohort with over 37,000 patients from a real-world medical claims database. The quantitative and qualitative results demonstrate the effectiveness of OntoPath through the consistent outperformance over state-of-the-art prescription recommendation baselines and the interpretation of model mechanism in case studies.', 'doi': '10.1145/3579994', 'url': 'https://doi.org/10.1145/3579994', 'issn': '1046-8188', 'number': '4', 'volume': '41', 'address': 'New York, NY, USA', 'publisher': 'Association for Computing Machinery', 'issue_date': 'October 2023', 'year': '2023', 'title': 'Ontology-aware Prescription Recommendation in Treatment Pathways Using Multi-evidence Healthcare Data', 'author': 'Yao, Zijun and Liu, Bin and Wang, Fei and Sow, Daby and Li, Ying', 'ENTRYTYPE': 'article', 'ID': '10.1145/3579994'}"
"Debiased, longitudinal and coordinated drug recommendation through multi-visit clinic records","Sun, Hongda and Xie, Shufang and Li, Shuqi and Chen, Yuhan and Wen, Ji-Rong and Yan, Rui",2022.0,ACM,"{'series': ""NIPS '22"", 'location': 'New Orleans, LA, USA', 'numpages': '13', 'articleno': '2019', 'booktitle': 'Proceedings of the 36th International Conference on Neural Information Processing Systems', 'abstract': ""AI-empowered drug recommendation has become an important task in healthcare research areas, which offers an additional perspective to assist human doctors with more accurate and more efficient drug prescriptions. Generally, drug recommendation is based on patients' diagnosis results in the electronic health records. We assume that there are three key factors to be addressed in drug recommendation: 1) elimination of recommendation bias due to limitations of observable information, 2) better utilization of historical health condition and 3) coordination of multiple drugs to control safety. To this end, we propose DrugRec, a causal inference based drug recommendation model. The causal graphical model can identify and deconfound the recommendation bias with front-door adjustment. Meanwhile, we model the multi-visit in the causal graph to characterize a patient's historical health conditions. Finally, we model the drug-drug interactions (DDIs) as the propositional satisfiability (SAT) problem, and solving the SAT problem can help better coordinate the recommendation. Comprehensive experiment results show that our proposed model achieves state-of-the-art performance on the widely used datasets MIMIC-III and MIMIC-IV, demonstrating the effectiveness and safety of our method."", 'address': 'Red Hook, NY, USA', 'publisher': 'Curran Associates Inc.', 'isbn': '9781713871088', 'year': '2022', 'title': 'Debiased, longitudinal and coordinated drug recommendation through multi-visit clinic records', 'author': 'Sun, Hongda and Xie, Shufang and Li, Shuqi and Chen, Yuhan and Wen, Ji-Rong and Yan, Rui', 'ENTRYTYPE': 'inproceedings', 'ID': '10.5555/3600270.3602289'}"
Safe medicine recommendation via star interactive enhanced-based transformer model,"Wang, Nanxin and Cai, Xiaoyan and Yang, Libin and Mei, Xin",2022.0,ACM,"{'keywords': 'Medicine recommendation, Star interactive enhanced-based transformer, Graph embedding', 'numpages': '12', 'month': 'February', 'journal': 'Comput. Biol. Med.', 'doi': '10.1016/j.compbiomed.2021.105159', 'url': 'https://doi.org/10.1016/j.compbiomed.2021.105159', 'issn': '0010-4825', 'number': 'C', 'volume': '141', 'address': 'USA', 'publisher': 'Pergamon Press, Inc.', 'issue_date': 'Feb 2022', 'year': '2022', 'title': 'Safe medicine recommendation via star interactive enhanced-based transformer model', 'author': 'Wang, Nanxin and Cai, Xiaoyan and Yang, Libin and Mei, Xin', 'ENTRYTYPE': 'article', 'ID': '10.1016/j.compbiomed.2021.105159'}"
Knowledge-Enhanced Attributed Multi-Task Learning for Medicine Recommendation,"Zhang, Yingying and Wu, Xian and Fang, Quan and Qian, Shengsheng and Xu, Changsheng",2023.0,ACM,"{'keywords': 'Medicine recommendation, knowledge graph embedding, multi-task, graph neural network', 'numpages': '24', 'articleno': '17', 'month': 'January', 'journal': 'ACM Trans. Inf. Syst.', 'abstract': 'Medicine recommendation systems target to recommend a set of medicines given a set of symptoms which play a crucial role in assisting doctors in their daily clinics. Existing approaches are either rule-based or supervised. However, the former heavily relies on expert labeling, which is time-consuming and costly to collect, and the latter suffers from the data sparse problem. To automate medicine recommendation on sparse data, we propose MedRec, which introduces two graphs in modeling: (1) a knowledge graph connecting diseases, medicines, symptoms, and examinations; (2) an attribute graph connecting medicines via shared attributes and molecular structures. These two graphs enhance the connectivity between symptoms and medicines, which thus alleviate the data sparse problem. By learning the interrelationship between diseases, medicines, symptoms and examinations and the inner relationship within medicine, we can acquire unified embedding representations of symptoms and medicines which can be used in medicine recommendation. The experimental results show that the proposed model outperforms state-of-the-art methods. In addition, we find that these two tasks: learning graph representation and medical recommendation can benefit each other.', 'doi': '10.1145/3527662', 'url': 'https://doi.org/10.1145/3527662', 'issn': '1046-8188', 'number': '1', 'volume': '41', 'address': 'New York, NY, USA', 'publisher': 'Association for Computing Machinery', 'issue_date': 'January 2023', 'year': '2023', 'title': 'Knowledge-Enhanced Attributed Multi-Task Learning for Medicine Recommendation', 'author': 'Zhang, Yingying and Wu, Xian and Fang, Quan and Qian, Shengsheng and Xu, Changsheng', 'ENTRYTYPE': 'article', 'ID': '10.1145/3527662'}"
Multi-view Graph Representation Learning via Mutual Learning for Drug RecommendationDrug Recommendation via Multi-view Graph Learning,"Wang, Liang and Wen, Wushao and Qin, Jinghui",2024.0,ACM,"{'series': ""IoTAAI '23"", 'location': 'Nanchang, China', 'numpages': '6', 'pages': '202–207', 'booktitle': 'Proceedings of the 2023 5th International Conference on Internet of Things, Automation and Artificial Intelligence', 'abstract': 'Drug recommendation aims to recommend a combination of drugs to patients with specific symptoms based on the interactions between symptom sets and drug sets. However, most existing methods focus on the interaction between single symptom and single drug, ignoring the set-level semantic information of symptoms and drugs. Moreover, they usually rely on complex medical records (such as history treatment records, diagnosis, lab tests, and procedures) to learn the representation of symptoms and drugs. To address these issues, we propose Multi-view Graph Representation Learning via Mutual Learning for Drug Recommendation (MGRL-DR), a novel method that only requires the symptom condition of patients and can capture the item-level and set-level interaction between symptoms and drugs via collaborative learning. Our framework will construct three graphs: symptom-drug interaction graph, symptom set-drug interaction graph, and drug set-symptom interaction graph, and train three graph-based information extraction modules in a single stage to capture the item-level and set-level semantic information of symptoms and drugs simultaneously. Extensive experiments on benchmark datasets show the significant improvements of MGRL-DR over the state-of-the-art methods.', 'doi': '10.1145/3653081.3653116', 'url': 'https://doi.org/10.1145/3653081.3653116', 'address': 'New York, NY, USA', 'publisher': 'Association for Computing Machinery', 'isbn': '9798400716485', 'year': '2024', 'title': 'Multi-view Graph Representation Learning via Mutual Learning for Drug RecommendationDrug Recommendation via Multi-view Graph Learning', 'author': 'Wang, Liang and Wen, Wushao and Qin, Jinghui', 'ENTRYTYPE': 'inproceedings', 'ID': '10.1145/3653081.3653116'}"
StratMed: Relevance stratification between biomedical entities for sparsity on medication recommendation,"Li, Xiang and Liang, Shunpan and Hou, Yulei and Ma, Tengfei",2024.0,ACM,"{'keywords': 'Intelligent healthcare management, Medication recommendation, Recommender systems', 'numpages': '15', 'month': 'January', 'journal': 'Know.-Based Syst.', 'doi': '10.1016/j.knosys.2023.111239', 'url': 'https://doi.org/10.1016/j.knosys.2023.111239', 'issn': '0950-7051', 'number': 'C', 'volume': '284', 'address': 'NLD', 'publisher': 'Elsevier Science Publishers B. V.', 'issue_date': 'Jan 2024', 'year': '2024', 'title': 'StratMed: Relevance stratification between biomedical entities for sparsity on medication recommendation', 'author': 'Li, Xiang and Liang, Shunpan and Hou, Yulei and Ma, Tengfei', 'ENTRYTYPE': 'article', 'ID': '10.1016/j.knosys.2023.111239'}"
